{
  "date": "2026-05-28",
  "date_epoch": 1748441400,
  "day": {
    "maxtemp_c": 18.5,
    "maxtemp_f": 65.3,
    "mintemp_c": 18.5,
    "mintemp_f": 65.3,
    "avgtemp_c": 18.5,
    "avgtemp_f": 65.3,
    "maxwind_mph": 12.4,
    "maxwind_kph": 12.4,
    "totalprecip_mm": 0.5,
    "totalprecip_in": 0.5,
    "totalsnow_cm": 1.0,
    "avgvis_km": 10.0,
    "avgvis_miles": 10.0,
    "avghumidity": 65,
    "daily_will_it_rain": 1,
    "daily_chance_of_rain": 1,
    "daily_will_it_snow": 1,
    "daily_chance_of_snow": 1,
    "condition": {
      "text": "Partly Cloudy",
      "icon": "//cdn.weatherapi.com/weather/64x64/day/116.png",
      "code": 1003
    },
    "uv": 4.0,
    "air_quality": {
      "co": 1.0,
      "o3": 1.0,
      "no2": 1.0,
      "so2": 1.0,
      "pm2_5": 1.0,
      "pm10": 1.0,
      "us-epa-index": 1,
      "gb-defra-index": 1
    }
  },
  "astro": {
    "sunrise": "05:30 AM",
    "sunset": "08:45 PM",
    "moonrise": "10:15 PM",
    "moonset": "06:42 AM",
    "moon_phase": "Waxing Crescent",
    "moon_illumination": 35.0,
    "is_moon_up": 1,
    "is_sun_up": 1
  },
  "hour": [
    {
      "time_epoch": 1748441400,
      "time": "sample value",
      "temp_c": 18.5,
      "temp_f": 65.3,
      "is_day": 1,
      "condition": {
        "text": "Partly Cloudy",
        "icon": "//cdn.weatherapi.com/weather/64x64/day/116.png",
        "code": 1003
      },
      "wind_mph": 12.4,
      "wind_kph": 12.4,
      "wind_degree": 1,
      "wind_dir": "WSW",
      "pressure_mb": 1013.0,
      "pressure_in": 1013.0,
      "precip_mm": 0.5,
      "precip_in": 0.5,
      "snow_cm": 1.0,
      "humidity": 65,
      "cloud": 40,
      "feelslike_c": 17.8,
      "feelslike_f": 17.8,
      "windchill_c": 12.4,
      "windchill_f": 12.4,
      "heatindex_c": 1.0,
      "heatindex_f": 1.0,
      "dewpoint_c": 1.0,
      "dewpoint_f": 1.0,
      "will_it_rain": 1,
      "chance_of_rain": 1,
      "will_it_snow": 1,
      "chance_of_snow": 1,
      "vis_km": 10.0,
      "vis_miles": 10.0,
      "gust_mph": 22.1,
      "gust_kph": 22.1,
      "uv": 4.0,
      "short_rad": 1.0,
      "diff_rad": 1.0,
      "et0": 1.0,
      "air_quality": {
        "co": 1.0,
        "o3": 1.0,
        "no2": 1.0,
        "so2": 1.0,
        "pm2_5": 1.0,
        "pm10": 1.0,
        "us-epa-index": 1,
        "gb-defra-index": 1
      },
      "pollen": {
        "Hazel": 1.0,
        "Alder": 1.0,
        "Birch": 1.0,
        "Oak": 1.0,
        "Grass": 1.0,
        "Mugwort": 1.0,
        "Ragweed": 1.0
      }
    }
  ]
}